{
  "annotator_role": "annotator_a",
  "asset_binding_status": "unbound_draft",
  "decision_status": "draft",
  "formal_freeze_eligible": false,
  "packet_id": "590326ce0aacbcac0fbab8802dff415c8bb42b5d378a2ddc3d160388da827865",
  "reviewer_id": "UNASSIGNED_ANNOTATOR_A",
  "schema_version": "0.1",
  "source_binding": {
    "asset_binding_status": "unbound_draft",
    "decision_count": 13,
    "protocol_draft_sha256": "41678577291a649004d1e0de6429d507dd5be8a26707f608bf270f879a02ffcf",
    "protocol_hash_scope": "file_bytes"
  },
  "submission_template": {
    "annotator_role": "annotator_a",
    "independent_without_peer_submission": true,
    "packet_id": "590326ce0aacbcac0fbab8802dff415c8bb42b5d378a2ddc3d160388da827865",
    "responses": [
      {
        "response": null,
        "subject_id": "BENCHMARK_SUITE_VISIBILITY",
        "subject_sha256": "2e773f7cb0ac717278866e86383756e243551c368af4b02fc60f22abab6a65f9",
        "task_id": "216ba4b8502ebd66e7841787fa7c0bca52282109eef3e1e57913078a20c50268"
      },
      {
        "response": null,
        "subject_id": "DEV_TEST_OVERLAP",
        "subject_sha256": "c713d0f2735fdb67f4724fcdb5740c5a0a5964722772d93e36c9c05ad83ecc3f",
        "task_id": "cfdc779a04cd3d201f0470ef4a2b9c90af1c83955711f83d02dac1713bfaf40f"
      },
      {
        "response": null,
        "subject_id": "TEST_DUPLICATE_CLUSTERS",
        "subject_sha256": "7aa862413da46bdc241d2ff2225faee82b6225504b5f12f1ae7a1b7de215dd50",
        "task_id": "16c513ae3d988621f017bef3d27d94f7aef89b6761935a61ceb37b91cfe0fd5d"
      },
      {
        "response": null,
        "subject_id": "B08_SUPPORTED_REJECTION",
        "subject_sha256": "42f213b1d9b820610ada2d8bff836ef72e38b7788f16ebf0448f76c598739a8b",
        "task_id": "0c4c54571f1e6ea803ca956f6b8c963402f0fc93e74ec8c6fd15d7ab27414aa9"
      },
      {
        "response": null,
        "subject_id": "ACTOR_CARDINALITY",
        "subject_sha256": "55808b0c3f10c368d8348b017f3a0352d475f5f1a7845e16bb0309601907c65a",
        "task_id": "12b8a539e2c1afb4988923ff46cd70fb5f6433f8c3265c4fa21220f2e25cd36a"
      },
      {
        "response": null,
        "subject_id": "LANE_TRISTATE",
        "subject_sha256": "4849763951280d15ac9b3fbe253d1c39360f4b8cea4d9d0e5c93fa560a606022",
        "task_id": "23bf29635dd9533a754526be2906f673c3cc2d27293aa3663078fe56dbfdb736"
      },
      {
        "response": null,
        "subject_id": "RISK_METADATA",
        "subject_sha256": "b27124d79035e3b97f87fb2a35db4da5bc05b398335aace1aa75d08642503cc5",
        "task_id": "163a7200a6bbe399a31ae0c907a2a5fef17e15e5072d3cd53ca494c78970c9ce"
      },
      {
        "response": null,
        "subject_id": "CPD_ELIGIBILITY",
        "subject_sha256": "31b6f6deb592f1977cece0eaf5a1c9e638d1da8b92374911ca4f9eeb32f676a1",
        "task_id": "16fbee9ffd2e42a9073230c34d6eabf370d87f99f043f9475ceda8504fd625f8"
      },
      {
        "response": null,
        "subject_id": "EVENT_ONTOLOGY",
        "subject_sha256": "79e83e73db96245a6dd006e8455e6bd5a20f1067cd281219795e062c05177821",
        "task_id": "7cb4ad90624be808b51421af34d01ff223e99454ea441becc47110ee3760493b"
      },
      {
        "response": null,
        "subject_id": "JUDGE_CALIBRATION_ROSTER",
        "subject_sha256": "fa2f748e517ae7cac449f15b8f981621815472d5e49b6270ebfd282ba0860cdd",
        "task_id": "15ed375df06b116b220eef6fa09caa61e10aad9b8de568fd31434b2eb07bdb59"
      },
      {
        "response": null,
        "subject_id": "RUNTIME_VALIDATION_CARLA",
        "subject_sha256": "779848ad653dd30eaba846f0d7eea51d7b7f2b24db24813c1df51b321c3d55f7",
        "task_id": "55f4406f01f938ea32b1460f6b62edebf7487aaeb46b9d9b670261c009998388"
      },
      {
        "response": null,
        "subject_id": "RUNTIME_VALIDATION_METADRIVE",
        "subject_sha256": "30fe5a1de6c50f759c20556de8ec49079cc5350a53b351f2f3b5555d5892af16",
        "task_id": "37cb32140bfcf04aa8e724c336a30d964ca5bcf70c4c7088b0b01b2cb6af5eda"
      },
      {
        "response": null,
        "subject_id": "EGO_PROXY_AND_CONTROLLERS",
        "subject_sha256": "cf402c20da1f0d8d965619a70f9f65cdbabed01950f96964e99980a834f5e127",
        "task_id": "bed9489ef88907464469df4083ee74f47eb6db623213718f04f0d66be897cec3"
      }
    ],
    "reviewer_id": "UNASSIGNED_ANNOTATOR_A",
    "schema_version": "0.1",
    "source_binding": {
      "asset_binding_status": "unbound_draft",
      "decision_count": 13,
      "protocol_draft_sha256": "41678577291a649004d1e0de6429d507dd5be8a26707f608bf270f879a02ffcf",
      "protocol_hash_scope": "file_bytes"
    },
    "submission_status": "pending",
    "workflow_type": "protocol_proposal_review"
  },
  "tasks": [
    {
      "asset_binding_status": "unbound_draft",
      "formal_freeze_eligible": false,
      "machine_proposal": {
        "decision_status": "draft",
        "draft_decision": "treat_the_252_query_suite_as_design_visible_and_locked_after_freeze; do_not_claim_held_out_generalization",
        "id": "BENCHMARK_SUITE_VISIBILITY",
        "reason": "The suite was available during evaluator development; immutability after freeze cannot recreate historical blindness."
      },
      "response_template": {
        "proposed_revision": null,
        "reason": "",
        "verdict": null
      },
      "subject_id": "BENCHMARK_SUITE_VISIBILITY",
      "subject_sha256": "2e773f7cb0ac717278866e86383756e243551c368af4b02fc60f22abab6a65f9",
      "task_id": "216ba4b8502ebd66e7841787fa7c0bca52282109eef3e1e57913078a20c50268"
    },
    {
      "asset_binding_status": "unbound_draft",
      "formal_freeze_eligible": false,
      "machine_proposal": {
        "decision_status": "draft",
        "draft_decision": "accept_all_16_development_intents_as_non_overlapping",
        "evidence": "No exact canonical, operation, topology, actor-role, rule-hook, or complete core-signature overlap was found; all 16 novelty notes still require human confirmation.",
        "id": "DEV_TEST_OVERLAP"
      },
      "response_template": {
        "proposed_revision": null,
        "reason": "",
        "verdict": null
      },
      "subject_id": "DEV_TEST_OVERLAP",
      "subject_sha256": "c713d0f2735fdb67f4724fcdb5740c5a0a5964722772d93e36c9c05ad83ecc3f",
      "task_id": "cfdc779a04cd3d201f0470ef4a2b9c90af1c83955711f83d02dac1713bfaf40f"
    },
    {
      "asset_binding_status": "unbound_draft",
      "formal_freeze_eligible": false,
      "machine_proposal": {
        "decision_status": "draft",
        "draft_decision": "keep_all_frozen_suite_queries_and_collapse_A07_E03_and_B09_E06_only_for_macro_statistics",
        "evidence_asset": "statistical_clusters_draft.json",
        "id": "TEST_DUPLICATE_CLUSTERS"
      },
      "response_template": {
        "proposed_revision": null,
        "reason": "",
        "verdict": null
      },
      "subject_id": "TEST_DUPLICATE_CLUSTERS",
      "subject_sha256": "7aa862413da46bdc241d2ff2225faee82b6225504b5f12f1ae7a1b7de215dd50",
      "task_id": "16c513ae3d988621f017bef3d27d94f7aef89b6761935a61ceb37b91cfe0fd5d"
    },
    {
      "asset_binding_status": "unbound_draft",
      "formal_freeze_eligible": false,
      "machine_proposal": {
        "decision_status": "draft",
        "draft_asset": "uqh_assessor_registry_draft.json",
        "draft_decision": "only_flagged_generation_counts_as_supported_acceptance; strict_rejection_lowers_A_s; freeze_an_independent_uqh_assessor_registry; require_one_content_addressed_assessment_for_every_reject_or_clarification; missing_assessment_is_a_pipeline_error; controlled_degradation_always_scores_zero_in_v0_1",
        "id": "B08_SUPPORTED_REJECTION",
        "reason": "UQH defines A_s as the supported-query generation disposition even though B08 metadata also lists strict rejection as acceptable. Independent response-byte evidence prevents method self-report from certifying H_u."
      },
      "response_template": {
        "proposed_revision": null,
        "reason": "",
        "verdict": null
      },
      "subject_id": "B08_SUPPORTED_REJECTION",
      "subject_sha256": "42f213b1d9b820610ada2d8bff836ef72e38b7788f16ebf0448f76c598739a8b",
      "task_id": "0c4c54571f1e6ea803ca956f6b8c963402f0fc93e74ec8c6fd15d7ab27414aa9"
    },
    {
      "asset_binding_status": "unbound_draft",
      "formal_freeze_eligible": false,
      "machine_proposal": {
        "decision_status": "draft",
        "draft_decision": "integer_is_exact; multiple_means_at_least_2; optional_is_permitted_min_0; zero_is_forbidden",
        "id": "ACTOR_CARDINALITY",
        "reason": "This preserves open cardinality without turning optional actors into required actors."
      },
      "response_template": {
        "proposed_revision": null,
        "reason": "",
        "verdict": null
      },
      "subject_id": "ACTOR_CARDINALITY",
      "subject_sha256": "55808b0c3f10c368d8348b017f3a0352d475f5f1a7845e16bb0309601907c65a",
      "task_id": "12b8a539e2c1afb4988923ff46cd70fb5f6433f8c3265c4fa21220f2e25cd36a"
    },
    {
      "asset_binding_status": "unbound_draft",
      "formal_freeze_eligible": false,
      "machine_proposal": {
        "decision_status": "draft",
        "draft_decision": "missing_is_unknown; optional_is_permitted; false_is_not_forbidden_without_explicit_surface_text",
        "id": "LANE_TRISTATE",
        "reason": "Sparse lane metadata does not justify closed-world absence."
      },
      "response_template": {
        "proposed_revision": null,
        "reason": "",
        "verdict": null
      },
      "subject_id": "LANE_TRISTATE",
      "subject_sha256": "4849763951280d15ac9b3fbe253d1c39360f4b8cea4d9d0e5c93fa560a606022",
      "task_id": "23bf29635dd9533a754526be2906f673c3cc2d27293aa3663078fe56dbfdb736"
    },
    {
      "asset_binding_status": "unbound_draft",
      "formal_freeze_eligible": false,
      "machine_proposal": {
        "decision_status": "draft",